doc_id	encoding	sentence	label	sentence_length
5322	utf-8	बौद्ध मंदिर बौद्ध धर्म के माने वाला लोग के प्रार्थना के अस्थान ह। एह में स्तूप मंदिर आ पैगोडा इत्यादि के सामिल कइल जाला। अलगअलग इलाका अनुसार बौद्ध मंदिरन के बनावट आ नाँव में भी अंतर देखे के मिले ला। आमतौर पर एगो बौद्ध मंदिर में खाली एकर बिल्डिंगे भर ना बलुक एकरे अगलींबगलीं के हिस्सा आ इलाका भी सामिल कइल जाला मुख्य रूप से ई पबित्र आ शांत वातावरण के रूप में पहिचानल जाला। एगो बौद्ध मंदिर के मकसद भीतरी आ बाहरी शांति के खोज में सहायक वातावरण के मानल जाला।	bhojpuri	454
4303	utf-8	sa confraternita dei preraffaelliti est stetia una currenti artistiga de sa pintura vittoriana xix sègulu nascia in santandria de su  sviluppara e spacciara in su rennu auniàdu	sardinian	176
6458	utf-8	intendite a esser considerate insimul solmente in cata caso considera un aspecto del soteriologia	interlingua	97
1687	utf-8	petē ī žmuogaus kūna vėita katruo jongas ronkas so krūtėnė	samogitian	58
1807	utf-8	dissenyat per a una missió de  sols amb possible ampliació a  sols però de fet va romandre actiu  sols	catalan	102
6290	utf-8	اوياهمدارنګه حاصلاتوکې چټک عايدات لري	pushto	37
4544	utf-8	na gregorian calender  novemba bu ubochi nke th th na afo nke anakpo leap year na afo	igbo	85
2769	utf-8	an babina chapaensis in nahilalakip ha genus nga babina ngan familia nga ranidae	waray	80
2157	utf-8	da guar la paz täuz ispanine nimi om nuestra señora de la paz ˈnwestɾa seˈɲoɾa ðe la pas «kožundan toi meiden emänd jumalanmam» keč chuqiyapu aimar chuqiyapu / chukiyawu / chuquiago marka om bolivijan kaikiš suremb lidn ičeze ezilidnoidenke niita om koumanz surtte da de fakto pälidn vspäi	veps	289
4888	utf-8	daarna is het nummer ook door anderen opgenomen onder wie charlie rich johnny rivers en elvis presley	dutch	101
3525	utf-8	საქართველოს პარლამენტის წევრი გახდა    წლებში	georgian	45
737	utf-8	talijanska okupacijska vojska došla je na rab	croatian	45
3826	utf-8	хануй голын хөндийд булган аймгийн баянагт сумын нутагт хойд өргөрөгийн ° зүүн уртрагийн °ын солбилцолд гидрокарбонат хлорид натри кальцийн найрлагатай рашаан бий	mongolian	162
2310	utf-8	tiuj homfaritaj strukturoj estas tipe konataj kiel abelujoj	esperanto	59
519	utf-8	itävallan vuoristoissa on kehittynyt monta erillistä saksan murretta	finnish	68
5719	utf-8	سال  دله همون گدر که دکترای دانشجو بیّه، نظریه va نیروهای قوی ره شه کشف هکرده	mazanderani	77
1236	utf-8	la drau o drave todesc drau talian cravuat e sloven drava ongjarês dráva serp drava/драва inglês drava o drave e je un afluent dal danau che al nas intal comun di san candido tod	friulian	178
70	utf-8	ژۊئيه ما پنجؤم؛ چندته سربس من جۊمله گيلمؤرˇ زنأک، يته آلبۊمˇ مۊنتشرأبؤنˇ جي به نؤم بي پايان رۊخؤنه خبر بدأن	gilaki	107
4569	utf-8	de michael ballack huet säit  am ganze  lännermatcher gespillt a bis elo  goler geschosset gëtt véier foussballnationalspiller déi pro lännermatch am duerchschnett méi wéi ee gol geschoss hun de gerd müller huet  goler an  lännermatcher geschoss – kuckt uewen	luxembourgish	259
3431	utf-8	подоцнежна студија покажала дека пред ерупцијата се случиле  земјотрес со интензитет над  пет недели пред вулканот да еруптира	macedonian	126
4957	utf-8	valéria harasztiová též valéria haraszti	czech	40
5249	utf-8	i koa xamsi ragve lamji la maldives	lojban	35
5393	utf-8	يىلى يانۋاردا «دۆلەتنىڭ aa دەرىجىلىك ساياھەت مەنزىرە رايونى» دەرىجىسىگە كۆتۈرۈلۈپ، يىپەك يولى ئالتۇن ساياھەت لىنىيەسىگە يېڭى بىر چاقناپ تۇرغان «مەرۋايىت» قۇشۇلدى	uighur	161
2710	utf-8	در آخر عصر x فردوس «شاهنام»  «شاهنام»  بی‌زوال خود را ایجاد کرد، که از جهت معنا و حجم در تمام ادبیات عالم همتایا ندارد	persian	118
1816	utf-8	ak itam pël yi ca mali foofu lañu ëppe woon ba tay tay jii foofa mooy diiwaan région bu mopti	wolof	93
2972	utf-8	cuimhním an ládar gcionn gur dhúisigh mé agus bhí mo chroí briste go raibh sé imithe	irish	84
176	utf-8	jack se je otresel svojih kriminalnih spon ko je postal spremljevalec devetega ter desetega doktorja v doctor whoju	slovene	115
4489	utf-8	da vart franzosa avev’ins sviluppà il plan d’occupar l’engalterra	romansh	65
4843	utf-8	од ломаньте сонзе эйсэ акортыть секс келесь састынге ёми	erzya	56
5255	utf-8	◄ |  ñiqin pachakwata |  ñiqin pachakwata |  ñiqin pachakwata | ►◄ |  watakuna |  watakuna |  watakuna |  watakuna |  watakuna |  watakuna |  watakuna | ►◄◄ | ◄ |  |  |  |  |  |  |  |  |  | ► | ►►	quechua	196
3896	utf-8	mokupuni o hawai‘i элек сандвич утраулары — тын океандагы архипелаг	tatar	67
353	utf-8	кошларны йортлаштыру йомырка алучанлыгын һәм тиз үтүчәнлеген өчен башкарылган	tatar	77
3513	utf-8	li primi spirimènti vinniru fattu cu la trazzioni animale ccu cavaddi e quarchi vota ccu voi mpaiati a dui a dui	sicilian	112
3717	utf-8	madankollu poll fapril  li użat itterminoloġija tarreferendem proposta sabet appoġġ ta % filwaqt % jappoġġjaw lunjoni	maltese	117
1425	utf-8	populasaun  iha tinan	tetum	21
1586	utf-8	جمهورية السودان džumhurijat as sudan angl	veps	41
2454	utf-8	koãga oĩ  térã  suakuéra juehegua ñande yvórape	guarani	47
1043	utf-8	ـــ په  رجب  هـ ق كال دوانت وايگل ولسوالي دجمچگل په سيمه كې داشغالگرو عسكرو خورا ستر بيس چې دوئ ته يې خورا ستراتيژيك اهميت درلود دمجاهدينو دمسلسلو بريدونو له امله تخليه كړ او گڼ شمیر غنيمتونه دمجاهدينو لاس ته ورغلل	pushto	214
3200	utf-8	yona imithi ehlala iluhlaza ihlala inamagqabi ayo unyaka wonke	xhosa	62
5456	utf-8	ಬೊನೊ  ಸೆಪ್ಟೆಂಬರ್  ರಂದು ಡೇವಿಡ್ ಎವಾನ್ಸ್ ದಿ ಎಜ್ ಆತನ ಸಹೋದರ ಡಿಕ್ ಮತ್ತು ಅಡಮ್ ಕ್ಲೆಯ್ಟನ್ ಮೌಂಟ್ ಟೆಂಪಲ್ ನ ಜಾಹಿರಾತೊಂದಕ್ಕೆ ಸ್ಪಂದಿಸಿ ಅಲ್ಲಿನ ಆ ಸಹವಿದ್ಯಾರ್ಥಿ ಲ್ಯಾರಿ ಮುಲಿಯನ್ ಜೂತಮ್ಮದೇ ಬ್ಯಾಂಡೊಂದನ್ನು ಆರಂಭಿಸಲು ಸಲಹೆ ನೀಡಿದ್ದಅದಕ್ಕೆ ಅವರು ಸಮ್ಮತಿಸಿ ಮುಂದಿನ ಹೆಜ್ಜೆಗಾಗಿ ಕಾಯ್ದರು	kannada	247
370	utf-8	steech hä zm usseminester op önö poste däm he bes zm joohr  behalde had	ripuarisch	71
28	utf-8	vanwehe zen gentsen ofkomst wor t een ok wè gandensis enoemd	zeeuws	60
3980	utf-8	área  km²	tetum	9
3661	utf-8	le village de samogneux a été le théâtre daffrontements francoallemands lors de la ere guerre mondiale	occitan	102
562	utf-8	après  e la fin de la guèrra de trenta ans la mainmise francesa safirma progressivament sus lo grand bailliage	occitan	110
5946	utf-8	absolvoval tedy tuto zkoušku na vlastní pěst za což byl potrestán zákazem hraní a tréninků dokud nepodepíše novou smlouvu	czech	121
5827	utf-8	han vann också den femte etappen av vuelta a castilla y león	swedish	60
4640	utf-8	буртаст кирдсть эсь ошпандсна мокша ди вад ляйге рязанонь ширязмодать ди идем паксянь бралги върьгятихнень каршес	moksha	113
386	utf-8	den	bokmål	3
2661	utf-8	ta radio çheet er ymskeaylley cowree rere moanaghey tonnyn lectrovagnaidagh lesh menkidyn ta ny sloo na menkidyn sollysh fakinagh	manx	129
1684	utf-8	iespējams tas radies sadursmes rezultātā ar lielu debess ķermeni kura pēdas vēlākos laikos tika izlīdzinātas ģeoloģiskās aktivitātes rezultātā	latvian	142
2596	utf-8	делегейниң кызыл дептеринче база кирген дириг амытаннар бар	tuvan	59
3979	utf-8	populasaun  iha tinan	tetum	21
1066	utf-8	בתום עונה זו זכה רויטר במשחק הסופר קאפ הגרמני לאחר ניצחון – בגמר על קייזרסלאוטרן במשחק בו רויטר הבקיע את השער הראשון	hebrew	116
6240	utf-8	او valuelessيې هغه ګټې دي کومې چې ترلاسه کيږي	pushto	45
3054	utf-8	la densidad de población era de  hab/km²	spanish	40
2684	utf-8	arabizimi i lindjes së mesme dhe mësimi në masë i anglishtes në bankat e shkollave po e tkurr gjithmonë e më shumë ndikimin e frëngjishtes shkruan le monde	albanian	155
1423	utf-8	balibar iha liaportugés balibar suku ida iha timór lorosae nian	tetum	63
2687	utf-8	niveli i studentëve frëngjishtfolës në rumani vazhdon të mbetet tepër i lartë por kjo sepse sipas sistemit arsimor rumun nxënësit janë të detyruar të mësojnë përveç anglishtes një gjuhë të dytë me zgjedhje dhe frëngjishtja është një zgjedhje e parapëlqyer	albanian	255
1821	utf-8	ñoom ñoo tabax nguuru fuutajalon	wolof	32
5896	utf-8	január jét	hungarian	10
235	utf-8	doda on tuntuks laulnud sellised hitid nagu szansa katharsis ja nie daj się	estonian	75
3040	utf-8	dre drapigoù ez ebarzher ar meskaj er gambr ha dre dredan pe dre wask en e losker kent e gas wardu ar pod skarzhañ	breton	114
517	utf-8	dr	tetum	2
2136	utf-8	el kondado de los ánjeles es uno de los kondados orijinalos de kalifornia krido al mismo tiempo kuando el estado fue admitido en la unión amerikana en	ladino	150
5193	utf-8	die geskatte bevolking in  was	afrikaans	30
6179	utf-8	alberto tarantini	quechua	17
3061	utf-8	આ એક મહેલ અર્ધ અષ્ટકોણાકાર ઝરૂખાઓનું ઝુમખું છે જે તેને અનોખું રૂપ આપે છે	gujarati	72
2680	utf-8	nga  milion nxënës që mësonin frëngjishten në vitin  në n numri arriti në  milion	albanian	81
6072	utf-8	etîmolog dibêjin wekî ziman zimanê kurdî nikare ji zimanên biyan ên ku ne ji koma zimanên îndogermanî ne peyvan hilwergire lê nayê	kurdish	130
5529	utf-8	ಮದ್ದೂರು ಗಂಜಾಂ ಮತ್ತು ಕೃಷ್ಣರಾಜಸಾಗರದಲ್ಲಿನ ತೋಟಗಾರಿಕಾಕ್ಷೇತ್ರಗಳು ಮತ್ತು ಬೆಂಗಳೂರಿನ ಸಮೀಪದ ಹೆಸರ್ ಘಟ್ಟದ ತೋಟಕಾರಿಕಾ ಸಂಶೋಧನಾ ಕೇಂದ್ರ ವು ಸಹಾ ಅವರ ಮಾರ್ಗದರ್ಶನದಲ್ಲಿಯೇ ಸ್ಥಾಪಿತವಾದವು	kannada	159
390	utf-8	október  var ítalskt barokktónskáld	icelandic	35
281	utf-8	адазын шудходдана дээр шакьялар күрүнезиниң хааны	tuvan	49
3892	utf-8	васьфневихть кучка ди лямбеширень америконь пиземвирьга	moksha	55
5834	utf-8	ba symptomes yango ezali	lingala	24
2509	utf-8	бисёр намуди гиёҳҳои шифобахшро дар ин мавзеъ ёфтан мумкин аст	tajik	62
2528	utf-8	қазақстанның барлық жерінде кездесетін  түрі бар	kazakh	48
401	utf-8	ab  mit dem erscheinen von microsoft windows  und dem ständigen zuwachs an benutzern wurden auch viren für dieses betriebssystem und dessen obligate programme wie microsoft office geschrieben	pampanga	191
214	utf-8	разположено е в полите на планината плана и източния край на самоковското поле	bulgarian	78
5607	utf-8	de variant vaan dees taol dee in chili gebruuk weurt neump me chileens spaons	limburgan	77
5469	utf-8	después aparecen marty y buttons en el remolque con charly	spanish	58
4071	utf-8	amur ameqqran seg yimezdaɣen n temnaḍta ssawalen s tefṛensist  % maca llan  % n wenglizwalen anglophones	kabyle	104
64	utf-8	سراخر، واترز اکراهˇ أمرأ بر کار گۊدنˇ پينک فلؤيد بي اينˇ حؤضۊر رضايت بدأ ؤ واترزˇ سيوايي پسي اي جرگه به رهبري گيلمؤر دۊته آلبۊم بيرۊن هدأ به نؤم آني لغزش  ؤ سيوايي ناقۊس	gilaki	169
578	utf-8	duach die drauf foigndn oagmoaunga hod si die zoi af  eahöht des is da stand vom	bavarian	80
4204	utf-8	la chapelledabondance relève de larrondissement de thononlesbains et de la cinquième circonscription de la hautesavoie dont le député est marc francina ump depuis les élections de	french	179
3868	utf-8	mollaýew çaklaýar	turkmen	17
6052	utf-8	aùtonomicznym dzélã szpańsczi są kanarijné òstrowë	kashubian	50
5443	utf-8	ئۇ ماتېماتىكا كەسپىگە ئائىت بىلىملەرنى ئۆگەنگەندىن سىرت يەنە «كومپيۇتېر قاتتىق ۋە يۇمشاق دېتال تېخنىكىلىرى»نى ئۆزلىكىدىن ئۆگەنگەن	uighur	129
4019	utf-8	tamén é o creador da serie de televisión urxencias	galician	50
1537	utf-8	джылгъа къазауатха дери джыллагъа кёре индустрия чыгъарыу  % кёб болады	karachay-balkar	71
6292	utf-8	دځنګل دتنظيم هد ف په ګډون دمختلفوفعاليتونوپه لاندې ډول دي	pushto	57
2220	utf-8	^ hwang sw et al direct activation of capsaicin receptors by products of lipoxygenases endogenous capsaicinlike substances	korean	122
1603	utf-8	изд	udmurt	3
5065	utf-8	onder deze naam werden er lezingen georganiseerd en konden er tegen een voordelig tarief bij de nederlandse luchtvaart school vlieglessen gevolgd worden	dutch	152
6400	utf-8	fù inoltri capaci di diducia i so leghji annantu à i pianeti senza cunnoscia i distanzi asatti di i pianeti da u soli postu chè i so analisi giumetrichi richiidivani solu u rapportu trà i distanzi rispittivi da u soli	corsican	217
3396	utf-8	اوفیزی انگلیسی جه galleria degli uffizi اتا موزه نوم هسته فلورانس ِشهر دله، ایتالیا ِکشور درون دره	mazanderani	98
3437	utf-8	de wieke amie hare hier ittere sint pieter en wolder zien geannexeerde en dus iers zelfstandige gemeintes	limburgan	105
2515	utf-8	atʼaʼ yiltʼąąʼí biiʼtó éí  tsinsitą́ dikʼą́ągo hahoodzo áádóó áadi  ánéelą́ąʼgo bílaʼashdlaʼii kéédahatʼį́ díí éí  yę́ędą́ą́ʼ diné daóltaʼdíne wóltaʼ	navajo	149
4831	utf-8	マーズ・エクスプロレーション・ローバー mars exploration rover mer mission は、年にアメリカ航空宇宙局 nasa が打ち上げた、火星の表面と地質を探る機の無人火星探査車（マーズ・ローバー）である。これは、nasaが実施した 年と年のバイキング着陸船、年のマーズ・パスファインダーに続く火星探査プログラムの一部であり、ミッションの科学的目標は過去の火星に水の活動があった手がかりを持つ広範囲の岩石および土壌を探査し、その証拠を見つけ出すことである。ローバーはそれぞれスピリット mera とオポチュニティ merb と名付けられている。	japanese	284
3777	utf-8	wara ttmiem talgwerra ilġermanja għallewwel ippreżentatha bħala vittma innoċenti li qatt ma kienet ikkollaborat masservizzi talispjunaġġ ġermaniżi	maltese	146
5636	utf-8	uba rampe kang dipunpasrahaken wonten kalih jinis inggih punika awujud uba rampe kang wonten ing kotak kayu lan apem mustaka cacah kalih kang dipuntutupi kain putih	javanese	164
4240	utf-8	li bileyderê mekteb u nexweşxane hene	kurdish	37
6209	utf-8	کوم چې يوله بل سره اړيکې لري	pushto	28
6096	utf-8	vivis sub la povresolineo % de la habitantaro e % de la familii	ido	63
554	utf-8	era cunoscut drept emisar neoficial al lui franklin d	romanian	53
3877	utf-8	astrnomiýa hakynda habybessiýer atly kitaby ýazypdyr	turkmen	52
2170	utf-8	ತಮ್ತಮ್ಮ ರಾಸಾಯನಿಕ ಮತ್ತು ಭೌತಿಕ ಗುಣಲಕ್ಷಣಗಳ ಆಧಾರದ ಮೇಲೆ ಮತ್ತು ನಿಶ್ಚಲ ಹಂತ ಎನ್ನುವ ನಿರ್ದಿಷ್ಟ ಕಾಲಮ್‌ನೊಂದಿಗಿನ ತಮ್ಮ ಪರಿಸ್ಪಂದನದ ಆಧಾರದ ಮೇಲೆ ಬೇರೆ ಬೇರೆ ವಿವಿಧ ರಾಸಾಯನಿಕಗಳು ವಿವಿಧ ವೇಗದಲ್ಲಿ ಸಾಗುತ್ತವೆ	kannada	179
3863	utf-8	mawerannahrly bolsada ol samarkantda ýaşap şol ýerde hem döredijilik işine başlaýar	turkmen	83
5408	utf-8	خیمهٔ مکیون پشت تپه‌یی بی‌یه و بدی‌ین نواشه	mazanderani	43
672	utf-8	desa ini sendiri terletak pada wilayah khusus di sungai sinaolea tepat di wilayah sungai yang menikung tajam dari selatan ke barat	indonesian	130
5234	utf-8	эртемденнерниң санап турарыбиле алырга ону бурунгу уйгулар баянчор элемтиш бильге каган чүгле шажын ужурдузалыг кылдыр эвес а камгалал шивээзи кылдыр база туткан	tuvan	161
3166	utf-8	ju mjobratte kon lääse twiske  un uur  meter	saterfriesisch	44
4356	utf-8	maaaring si peruggia ay naudyukan ng kaniyang mga kaibigang may mga kopya o replica ng mona lisa na baká sakaling lumakas ang bentahe ng mga ito kung mawawala ang mona lisa at makilala sa mundo	tagalog	193
1998	utf-8	ihe eji ama na nwaanyị atụrụla ime gụnyere ahụzighị nsọ ya inwe obere ara agụụ ịgụ ya mgbe mgbe na ịnyụ mamịrị	igbo	110
6564	utf-8	нәсел башы булып иван кирилл улы стахеев  исәпләнә	tatar	50
6343	utf-8	web uygulamalarına özgü açıklıklar için aramaya ilave olarak araçlar yazılım kodlama hatalarına da bakabilmektedir” açıklıkların giderilmesi genellikle çözüm aşaması olarak anılmaktadır	turkish	185
2654	utf-8	katonga gwe gumu ku migga egisinga obunene mu gigabirira ennyanja nnalubaale	luganda	76
6648	utf-8	ny kaodinkaominina dia  ary ny kaodindistrika dia	malagasy	49
505	utf-8	deg assileɣ nwen i timeẓriwt n aṭas n isura d taɣuri n aṭas n idlisen teẓram belli asaḍ nwen ad yettwassukkes … albaɛḍ yessefrad kra acku urdtgezmen ara aqerruyis — alma d taswiɛt id gezmen aqerruyis	kabyle	199
5499	utf-8	v in verschiedenen formen wieder	german	32
6520	utf-8	to talamusu omogućava da ih integrira i zaključi šta receptori prenose senzornoj kori velikog mozga	bosnian	99
4774	utf-8	רבי איטשעלע האט געהייראט בזיווג ראשון מרת חנה א טאכטער פון זיין עלטערפעטער הרב ראובן הורוויץ רב אין דעמביץ  א זון פון רבי אליעזרל דזשיקאווער	yiddish	140
151	utf-8	unong ed  census say papulasyon to et  totoo	pangasinan	44
6293	utf-8	– دکرل کيدونکي stockکنټرول چې دابي ساختما ن اوتشکيل دی	pushto	54
4296	utf-8	მუჭოთ ბჟაეიოლიშ თეშ ბჟადალიშ მონასტერეფც მუნეფიშ მეურნობა უღუნა	mingrelian	63
6151	utf-8	елганың тамагы силоваяха елгасының сул ярыннан  км ераклыкта урнашкан	tatar	69
1389	utf-8	al pâs lé traversê da la strêda pruvincêla  ind al teritôri tuscân ch la dvèinta strêda pruvincêla  in teritôri emiliân	emilian	119
5202	utf-8	kr	saterfriesisch	2
6536	utf-8	ఈ టెక్నిక్‌ను క్లే యానిమేషన్‌లో సాధారణంగా వాడుతారు	telugu	50
776	utf-8	diagnosis is easier in typical acute appendicitis and surgery removes a swollen appendix with little or no suppuration pus if operated early within  hours of onset	newari	163
5042	utf-8	نۆۋەتلىك تۈركىيات تەتقىقاتلىرى خەلقئارالىق ئىلمىي مۇھاكىمە يىغىنى ماقالىلەر يوپلىمى، ھاجەتتەپە ئۇنىۋېرسىتېتى تۈركىيات تەتقىقاتلىرى ئىنىستىتوتى نەشرىياتى،، يىلى، ئەنقەرە، تۈركىيە تۈركچە	uighur	184
4067	utf-8	treliso sako e papera filtrili esas uzita per deprenar granda partikuli inkluzita mikrofiltrago ultrafiltrago nanofiltrago reversa osmo dializo uzinta sintezala membrani povas separar mikrometrostatura o plu mikra speci	ido	219
1493	utf-8	پنجن پڪ سرن مقبرن جا رڳو بنياد بچيا آھن	sindhi	39
2305	utf-8	mohammed volledige arabische naam moehammad ibn abd allah ibn abd almoettalib ibn hasjim ibn abd manaf alkoeraisji mekka ca	zeeuws	123
1164	utf-8	ანარქიზმიქ ინირსხუ უილიამ გოდვინიშ  ნაჭარეფს	mingrelian	44
3283	utf-8	fra il  e il  al recite intal jurasoyfertheater a viene e in altris teatris plui piçui al fâs ancje il regjist il diretôr artistic e il produtôr	friulian	144
2929	utf-8	phnom penh ni oluilu re ati ilu titobijulo nibe ohun si tun ni gbanga fun okowo aje ileise ati asa ni kambodia	yoruba	110
471	utf-8	ອົງກອນນິຕິບັນຍັດ ຫຼື ສະພາ ແມ່ນ ໜຶ່ງ ໃນ  ອຳນາດລັດ ຄື  ອຳນາດນິຕິບັນຍັດສະພາ ອຳນາດບໍລິຫານລັດຖະບານ ອຳນາດນິຕິບັນຍັດສານ	lao	112
4862	utf-8	rahvahidenkeskeine civiline gbessiilendimport cky sijadase  km pohjoižpäivnouzmha lidnan keskusespäi tombosarespäi kalumnemakon suvirandal	veps	138
4514	utf-8	malí de la primera fase en octavos de final pitó el partido brasil vs	spanish	69
3649	utf-8	important tamién yera o convento de santa fe establito en  o mesmo puesto a on yera en tiempos medievals a mezquita mayor da morería	aragonese	132
2854	utf-8	umi mokõi pehẽngue osẽ joaju kuatiápe hérava política de dios gobierno de cristo sacada de la sagrada escritura para acierto del rey y del reino en sus acciones	guarani	160
5283	utf-8	лама кизефкста	moksha	14
1224	utf-8	pishiq va elastik jiloli boʻlib yiltirab turadi	uzbek	47
1453	utf-8	päämäne hädä om näile lakõq alaq – noorõndiguq ja lakõs raoduq langiq kost näil om rassõ ja eloohtlik üle saiaq selle et nä ommaq maa pääl liikun väega aigladsõq ja kohmaguq	võro	173
3810	utf-8	ስሙ ከጦንቡሪ ወደ ክሩንግ ጠፕ ተቀየረ፣ የአገሩም ስም ደግሞ «የራታናኮሲን መንግሥት» ሆነ። «ክሩንግ ጠፕ» እስካሁን ይፋዊ ስሙ ሆኗል፤ «ባንግኮክ» የሚለው ስያሜ እንዲያውም መጠሪያ ሲሆን በተለይ የውጭ አገር ሰዎች እንዲህ ይሉታል።	amharic	147
6254	utf-8	دونودکينولوپواسطه په بيلابيلووختونوکې بيلابيل محصولات ترلاسه کيږي	pushto	65
3960	utf-8	ti sub probinsia ti guimaras ket naudi idi a nairepresenta a kas paset ti maikadua a distrito idi  kalpasan idi daytoy ket nagbutos ti bukodna a pannakabagi a kas maysa a nawaya a probinsia	iloko	189
6147	utf-8	ശെഖെവാൾ ലെ  വയസ്സിനു താഴെയുള്ള കുട്ടികളുടെ എണ്ണം  ആണ്	malayalam	53
5198	utf-8	şubat  yılında comodo kötü niyetli reklamlara karşı kullanıcıları korumayı iddia eden privdog olarak bilinen bir maninthe middledan koruyan ürününü duyurdu	turkish	155
48	utf-8	jedźino mjejscowość na wyspje to hanga roa	silesian	42
5475	utf-8	neodiumdotierde yag lasere ndyag n kräftigen infraroodlaser die der anwoand wäd foar snieden laskjen en beskriftjen fon metalle un uur materialien	saterfriesisch	146
4533	utf-8	mens usa havde lovet aldrig at indlede gaskrigsførelse havde japan brugt gas mod kineserne tidligere i krigen	danish	109
2199	utf-8	c esteut dandjreus on tiyoû	walloon	27
4736	utf-8	canadensis is a creeping rhizomatous perennial growing to about  cm  in tall	english	76
1481	utf-8	agresywno polityka zagrańiczno kero stosowoł doprowadźyła do rozpyntańo bez ńymcy ii wojny śwjatowyj we wyńiku keryj zginyło  miljůnůw ludźi	silesian	140
