doc_id	encoding	sentence	label	sentence_length
5141	utf-8	रारा राष्ट्रिय निकुञ्ज पश्चिम नेपालक मुगु जिलामे अवस्थित अछि जे रारा ताल तथा ओकर अगलबगलक क्षेत्रक अगोटने अछि । एकर क्षेत्रफल  बर्ग किलोमिटर अछि । ई निकुञ्ज सन्  मे स्थापापना भेल छल । ई निकुञ्ज भितर नेपालक सबसँ पैग ताल राराताल रहल अछि आर तहिसँ एकर नामाकरण कएल गेल छल । ई निकुञ्ज  मिटर सँ  मिटर धरिक उचाईमे रहल अछि । एतएक कस्तुरी मृग थार भालु आदि पाबल जाएत अछि ।	maithili	360
330	utf-8	samkvæmt búddisma er hluti af því að lifa að þjást og sú þjáning á sér upphaf sitt í þrá	icelandic	88
6467	utf-8	دېڭىز ئوكيان چىگرىسى بولمىغان بۇ دۆلەتنىڭ قوشنىلىرى شىمال ۋە غەربتە قازاقىستان، شەرقتە قىرغىزىستان ۋە تاجىكىستان، جەنۇبتا تۈركمەنىستان ۋە ئاڧغانىستان باردۇر	uighur	156
5900	utf-8	en af lillepils oprindelige ulvehunderyttere	danish	44
328	utf-8	польшаысь валтӥсь статистической управление gus сямен та агломерациын  кар вань	udmurt	79
2224	utf-8	el xe restà segretario fin al  quando che el ga łasà el posto a luigi angeletti	venetian	79
3472	utf-8	gn aveut des flamåjhes ki volént divè l moye di strin c esteut on plan po rayi tot l sintfruskin	walloon	96
4624	utf-8	zao % famülas e % lödanefa lölik älifons dis pöfasoliad keninükamü % utanas bäldotü lifayels  u läs  e % utanas bäldotü lifayels  u plu	volapük	135
3873	utf-8	onuň dil bilimi barada hem ýazan işleri bar	turkmen	43
2553	utf-8	di cara vinirã romanjlji tu balcanu armãnjlji sfeatsirã ca un popul cu limba romanicã	aromanian	85
5938	utf-8	díí atsʼii honiigaah éí doo ayóʼ bahónéʼdaʼ	navajo	43
5258	utf-8	doomu esrom la woon di maamaatu daawuda ch  ru	wolof	46
3814	utf-8	när biltrafiken ökade anlades  söder om stadskärnan södra ringen en väg med två körfält på vardera två körbanorna mellan malmövägen och trollebergsvägen för att avlasta innerstadstrafiken	swedish	187
4227	utf-8	тхьэкӏумэхэр инкъым хуэхуреуэ щытхэщ	kabardian	36
5022	utf-8	uno de cada  personas pertenece a las fuerzas armadas y uno de cada  ha sido encarcelado	chavacano	88
3058	utf-8	મહેલના ઉપરના ત્રણ માળની પહોળાઈ એક ખંડના માપ જેટલી છે જ્યારે પહેલાં અને બીજા માળની પાછળના ભાગમાં આંગણાં જેવી આગાશી છે	gujarati	116
6318	utf-8	веде від залізничного вокзалу до виїзду з міста а також є одною з найдовших серед вулиць міста	ukrainian	94
921	utf-8	awa rinotaridza nevara h kana hr sokuti awa mbiri h	shona	51
5405	utf-8	ян ге́йдушка псевдоним — фи́лякс влуж	russian	37
1590	utf-8	a dal első televíziós előadására	hungarian	32
5743	utf-8	grünwald es egardat quam li max rich municipie de germania	interlingue	58
4878	utf-8	le fa go ntse jalo merogo mengwe e dirisiwa mo dijong tse di nang le sukirinyana jaaka rhubarb pie le carrot cake	tswana	113
2483	utf-8	ba í an mbéarla an máthairtheanga do % don daonra sa blian céanna	irish	65
2777	utf-8	júpíta je ise awari pelu opolopo akitiyan nipa lilo okoofurufu roboti agaga nigba ti awon asewadi akoko bii pioneer ati voyager leyin awon wonyii ni galileo orbiter	yoruba	164
3691	utf-8	rao kannada ಚಿಂತಾಮಣಿ ನಾಗೇಶ ರಾಮಚಂದ್ರ ರಾಯ bengaluri die  iunii  est chemicus indianus	latin	83
3752	utf-8	an saintromainlachalm udalerrian erroldatutako biztanleak  ziren	basque	64
3866	utf-8	sebäbi onuň şygyrlarynyň arasynda emir temiriň neberelerinden bolan  ýyllarda häkimlik eden halyl soltana bagyşlanyp ýazylan kasyda bar	turkmen	135
1923	utf-8	салауат юлаев исемендәге дәүләт  һәм башҡортостан комсомолының ғәлимов сәләм исемендәге  премиялары лауреаты	bashkir	108
884	utf-8	ಉಂಡು ರಡ್ಡ್ ಕ್ರಮೊನ್ ಮಸ್ತ್ ಮಟ್ಟಿಗ್ ಇಸ್ರೇಲ್‍ಟ್ ಜಾರಿಟ್ ಉಂಡು	tulu	55
67	utf-8	وختي گه جرگه أمأنه جي اينˇ جي بپۊرسن، گيلمؤر تؤضيح بدأ گه پينک فلؤيد ده نۊخؤندنه ؤ اۊن  سالگي ميئن ترجيح دئنه خۊ شخصي پؤرؤژه سر کار بکۊني	gilaki	137
349	utf-8	झाडांच्या खोडात असलेल्या भोकात गावतचिंध्या केरकचरा गोळा करून घरटं केलं जातं मार्च ते जलै दरम्यान वीण होते	marathi	105
4058	utf-8	pare chì barbaru avissi ordinatu di brusgià ne dopu u corpu	corsican	59
2833	utf-8	while running a campaign to elect his sister sherry martschink to lieutenant governor in  shealy with the help of robert kohn recruited unemployed black fisherman benjamin hunt jr	english	179
3150	utf-8	sanoatkontexnazorat  oʻzbekiston respublikasi hududidagi kon sanoatida ishlarni bexatar olib borish yer osti boyliklaridan maqsadga muvofiq foydalanish va ularni muhofaza qilish mineral xom ashyoni sarflashga oid qonunlarga meʼyoriytexnik huquqiy hujjatlar talablariga rioya qilinishi ustidan nazoratni amalga oshiruvchi davlat inspeksiyasi	uzbek	340
1216	utf-8	rangi kora malla okish boʻladi bu asosan sochdagi pigmentlar miqdoriga bogʻliq	uzbek	78
1292	utf-8	karaa biraa yoo himamu akkuma dhiirri dubartii malee ilmoo godhachuu hindandeenye caaccuu malee kallachis tajaajila hinkennu	oromo	124
3704	utf-8	mąʼiitsoh bitsʼíís éí łibá dóó yishtłʼizhgo naashchʼąąʼ łeh łaʼ éí daalgai dóó daaltsxo ałdóʼ	navajo	93
3531	utf-8	lemesed „per capita“ a pösod äbinon mö us	volapük	41
3465	utf-8	lemesed patedik lomanefa in oak hill äbinon mö us  e lemesed patedik famüla äbinon mö us	volapük	88
4049	utf-8	toxench lokak aplea ghorant bosimni poinn kortana tim aikunk melltolim	konkani	70
2778	utf-8	oko iwadi to pese lo si júpítérì ni okoofurufu to n lo si pluto new horizons ni opin osu irele	yoruba	94
6649	utf-8	krugerrond කාසියක් හා sovereign කාසි  ක් මෙහි ඇත උද්දධමනය සමයන්හි රන්මිල නෝට්ටුවල වටිනාකමට වඩා ශිග්‍රයෙන් ඉහළ යයි	sinhala	113
1223	utf-8	sogʻlom s	uzbek	9
6479	utf-8	اینتا قطعنومه، نشست ٬‌ام دله تصویب بَیّه	mazanderani	40
154	utf-8	sikato et walad alenleneg distrito	pangasinan	34
3405	utf-8	in latere jare is goud daar naby ontdek	afrikaans	39
2954	utf-8	בשנים – כיהן כשגריר ארצות הברית לרוסיה	hebrew	38
6359	utf-8	sikato et walad kumatlo ya distrito	pangasinan	35
2656	utf-8	laga postu administrativu ida iha munisípiu baukau timór lorosae nian	tetum	69
6670	utf-8	лаптăкĕ  км	chuvash	11
1804	utf-8	in minz da vardad po esser cuntegnì en quai damai che dante aveva apparentamain enconuschientscha da sias ovras e da sias stentas da popularisar la savida latina en las linguas dal pievel	romansh	187
1337	utf-8	seus pais são clara e mark stevens	portuguese	34
4528	utf-8	celentano cita tale motto per incitarli a dare il meglio in vista della finale di basket	italian	88
1516	utf-8	ħdaxil xahar wara ilpapa girgor ix iddikjarah qaddis	maltese	52
3783	utf-8	u nilu ghjucò un rollu cruciali in a fundazioni di a civiltà egiziana	corsican	69
5211	utf-8	اون از هونر به عونوانه ایته ابزار برای انسان دوستی استفاده کونه	gilaki	63
5790	utf-8	rûnê zeytê berdin quşxaneyê sîra kutayî firingî gir hûrkirî goşt bamye xwê îsota tûj tevlî bikin bidin ser agir	kurdish	111
4571	utf-8	súd potom vyberal z týchto návrhov	slovak	34
1391	utf-8	ричардсон енгл	serbian	14
1205	utf-8	تدبیر فلاح و نجات و اصلاح چند سوالات کا جواب ہے، جو ھ میں حاجی منشی لعل خان نے امام احمد رضا خان سے پوچھے تھے۔ یہ فتاویٰ رضویہ کی بارہویں جلد میں بھی شامل ہے، اور الگ سے بھی شائع ہوا ہے۔	urdu	186
3292	utf-8	w bédënkù w ti sprawie sczerowónym do nôrodnégò institutu spôdkòwiznë je òbmëslënk dzejaniów chtërne pòdtrzimùją żëwòtnosc wësziwaniô i służą jegò òchrónie na cząd  lat	kashubian	168
2143	utf-8	բելոգլինկա ուկր՝ білоглинка ղրիմի թաթարերեն՝ aqtaçı qıyat գյուղ ուկրաինայի ղրիմի ինքնավար հանրապետության սիմֆերոպոլի շրջանում։ բնակավայրը նախկինում նաև անվանվել է ակտաչիկիյատ։	armenian	175
1996	utf-8	nke a bụ ihe dịka izu ụka nwaanyị tụụrụ ime	igbo	43
4725	utf-8	район мустанг межує з тибетом знаходиться між непальськими провінціями долпо і мананг	ukrainian	85
4638	utf-8	go thusa eng go nyala motho mme o le bokoa ka ntlha ya go sa tiisang maatla a mmele ka tshwanelo a jaana ebile ga se kotsi fa ditokololo di sa dirisiwe gonne foo di ka gokgafala	tswana	177
5836	utf-8	בשנים    הוא היה מצליף קואליציית הcdu/csu ובנובמבר  הפך ליושב ראש הקואליציה	hebrew	75
1595	utf-8	karel de kletsn was de joungste zeune van keizer lodewyk de vroomn en z’n twidde vrouwe judith van beiern	vlaams	105
663	utf-8	u ér de janviér  la comena comptâve   habitents	arpitan	47
565	utf-8	bibiliya epɛsi eyano na mokanda mwa luka	lingala	40
2861	utf-8	li estas la oka el naŭ filioj de mario prodi inĝeniero el kampara familio kaj enrica istruistino	esperanto	96
719	utf-8	він веде успішну карєру вокаліста бере участь у концертах та збірниках і випускає сольні альбоми та сингли	ukrainian	106
3486	utf-8	ווען די דאזיגע סובמארינען זענען געווען אונטער דעם וואסער זענען זיי געווען א געפאר פאר זייערע שונאים און סאיז געווען שווער צו זען זיי אבער ווען זיי זענען געווען אויפן וואסער אנצולאדן איז געווען גרינג צו אטאקירן זיי	yiddish	213
4568	utf-8	lefelo le le butswe ka ngwaga wa  ebile lefelo le la bogorogele le nale mantlo a borobalo a le masome a mabedi le bonemantlo a a agilwe ka bonokopila jo bo jesang matlho monatlemo teng ga ntlo ngwe le ngwe moeng o fitlhela sepe se a se tlhokang	tswana	244
4395	utf-8	septembar	bosnian	9
906	utf-8	ири дарыяларынын нямунас жана башка өрөөндөрүнө аллювий топурактары мүнөздүү	kirghiz	76
3721	utf-8	закатул фитіри кьола хiажатав мискинав чиясе	avar	44
6640	utf-8	дубасов тяштсь што «всероссийскяй провинциясь народнай эряфть сузмоц юроц сонь сембода оцю козяшиц надияма вастоц	moksha	113
4266	utf-8	ਦੀ ਨਕਲ ਕਰਨੀ ਚੋਭਾਂ ਦਾ ਜੁਆਬ ਦੇਣਾ ਅਤੇ ਅਣੂਆਂ ਨੂੰ ਇੱਕ ਥਾਂ ਤੋਂ ਦੂਜੀ ਥਾਂ ਲਿਜਾਣਾ ਹੈ। ਪ੍ਰੋਟੀਨ ਇੱਕ ਦੂਜੇ ਤੋਂ ਮੁੱਖ ਤੌਰ ਉੱਤੇ ਆਪਣੇ ਅਮੀਨੋ ਤਿਜ਼ਾਬਾਂ ਦੀ ਤਰਤੀਬ ਦੇ ਅਧਾਰ ਉੱਤੇ ਵੱਖਰੇ ਹੁੰਦੇ ਹਨ ਜਿਹਨਾਂ ਦੀ ਉਸਾਰੀ ਜੀਨਾਂ ਦੀ ਨਿਊਕਲੀਓਟਾਈਡ ਤਰਤੀਬ ਮੁਤਾਬਕ ਹੁੰਦੀ ਹੈ ਅਤੇ ਜਿਹਨਾਂ ਦੇ ਨਤੀਜੇ ਵਜੋਂ ਪ੍ਰੋਟੀਨ ਨੂੰ ਵਲ਼ ਦੇ ਕੇ ਇੱਕ ਖ਼ਾਸ ਤਿੰਨਪਾਸਾਈ ਢਾਂਚਾ ਬਣਾ ਦਿੱਤਾ ਜਾਂਦਾ ਹੈ ਜਿਸ ਨਾਲ਼ ਉਹਦੇ ਕੰਮ ਮੁਕੱਰਰ ਹੁੰਦੇ ਹਨ।	panjabi	353
2144	utf-8	ls paísesnembros oureginales éran líbano eigito eiraque síria emirado de la transjordánia atual jordánia arábia saudita iémen i repersentantes de l árabes palestinos	mirandese	165
1670	utf-8	end aveut d cénk sôres  des avou les caracteres cirilikes les cenes k on vindeut l pus	walloon	86
954	utf-8	ಮೈ	tulu	2
264	utf-8	အဲဒီမှာ ပုံနှိပ်ပြီးတဲ့ စာမူတွေကို အဲဒီတုန်းက ကိုလေးမောင်၊ ကိုအောင်ငြိမ်း ကျွန်းပြန် တို့ နေတဲ့ မန္ဈလေး  လမ်း၊ မန်းညွန့် ဦးမောင်လေး တိုက်နဲ့ မျက်နှာချင်းဆိုင်က ကိုစောလွင် မတကသ ဥက္ကဋ္ဌဟောင်း၊ စာရေးဆရာ မောင်တောလူ အိမ်မှာ ချုပ်ကြ၊ အဖုံး ကပ်ကြပါတယ်။ မအေးစန်း ကဗျာ ဆရာမ မစိမ်းပင် နဲ့ သူစည်းရုံး ထားတဲ့ လူငယ်လေး တွေလည်း ပါဝင် ကြပါတယ်။ ပထမဆုံး စာအုပ် တအုပ် ထွက်လာတော့ ခိုးကြောင်ခိုးဝှက် လုပ်ရတာ ဝမ်းသာလွန်းလို့ အနားမှာ ရှိနေတဲ့ လူတွေ အားလုံး လက်မှတ် ထိုးကြပါတယ်။ နောင်ကျမှ “ဟာ၊ ဒီစာအုပ်များ သိမ်းမိ သွားရင် …” ဆိုတဲ့ အတွေးနဲ့ လန့်ကုန် ကြတာလည်း မှတ်မိ နေပါတယ်။	burmese	552
6463	utf-8	utilizouse vasta base de dados dos crimes cometidos no reino unido acerca de carreiras criminais individuais para se obter insights analíticos	portuguese	142
2228	utf-8	بۇ تارىخىي خاتىرىلەر قەدىمقى زاماندا كۇچا ئەتراپىدا تاغدىن كۆمۈر چىقىدىغانلىقى ۋە تۆمۈر تاۋلايدىغانلىقىدەك پاكىتنى چۈشەندۈرۈپ بىرىدۇ	uighur	132
1179	utf-8	марков уделяет большое внимание развитию международных контактов республики коми укреплению конструктивного сотрудничества национальных движений»	komi	145
4641	utf-8	अम्बिका महाभारतमे काशीराजक पुत्री बताएल गेल छल । अम्बिकाक दुईटा बहिन छल पैग बहिन अम्बा तथा छोट बहिन अम्बालिका । अम्बा अम्बिका आ अम्बालिकाक स्वयंवर होमए वाला छल । हुनकर स्वयम्वरमे जाए अकेले भीष्म ओतय आएल समस्त राजासभके परास्त करि देलक आ तीनु कन्याके हरण करि हस्तिनापुर ल गेल जतय ओ तीनु बहिनके सत्यवतीक सामने प्रस्तुत केलक ताकि हुनकर विवाह हस्तिनापुरक राजा आ सत्यवतीक पुत्र विचित्रवीर्यके संग सम्पन्न भ जाए । अम्बिका आ अम्बालिका विचित्रवीर्यक पत्नि बनल । मुदा विचित्रवीर्यक अकाल मृत्यु भेला कारण ओ दुनु निःसन्तान रहि गेल । भीष्म पहिनेसँ ब्रह्मचर्य व्रतक शपथ लेनए छल आ आब दुनु पुत्र चित्राङ्गद तथा विचित्रवीर्यक अकाल मृत्युके कारण कुरुवंशक वंश खतरामे छल । एहि अवस्थामे सत्यवती अपन सबसँ पैग पुत्र वेद व्यासके याद केलक आ नियोगक विधिसँ अम्बिका आ अम्बालिकाके गर्भाधान करेलक ।	maithili	768
4824	utf-8	des gebiet is komplett bewoidt	bavarian	30
4304	utf-8	arregordara su simbolismu	sardinian	25
1144	utf-8	fuje pure maesto e legge e litteratura e nu funzionario guvernativo	neapolitan	67
5137	utf-8	dopu à a secunda guerra mondiale si insedianu stabilmente termini relativi à u sviluppu tecnuloghjcu è ecunomico parechji sò prestiti di necessità ovveru ùn traducibili cù lemmi ghjà esistenti kit jeans film killer partner okay puzzle scout spray west punk rock lessicu finanziariu cume budget marketing meeting business parttime infurmaticu cume click cliccare cumputer formattare hardware software mouse spurtivi cume goal ancu gol corner cross assist baseball basketball sponsor hobby zoom	corsican	492
5942	utf-8	začínal ve věku  let v týmu pčsp košice po dvou letech odešel do	czech	64
1325	utf-8	तमिळ भाशेकडेन संबंदीत आशिल्ली कुरूख ही उराँव आदिवासीची भाशा आसा	konkani	63
5867	utf-8	kritola gresk κρίτολα virksom på tallet fkr var en gresk kvinne tilhørende kongefamilien i kyrenaika	bokmål	100
5694	utf-8	tante compagnie multinasionali gha le loro sedi centrali a nairobi	venetian	66
4099	utf-8	නමුත් මෙය යුරෝපයට දර්ශනය වේද යන්න පිළිබඳව තීරණය කිරීමට ඔහුගේ ක්‍රමවේදය ප්‍රමාණවත් නොවිය	sinhala	87
6466	utf-8	ئۆزبېكىستان بۇگۈن خەلقئارادا مەۋجۇد مۇستەقىل  تۈركىي جۇمھۇرىيەتلەرنىڭ بىرى بولۇپ، تۈركسوينىڭ ئەزاسىدۇر	uighur	102
1747	utf-8	ti distrito ti binondo ket isu ti chinatown ti siudad	pangasinan	53
5400	utf-8	i cavàlli ean importanti pei trasporti pe o lòu comme alimento pei vestî e comme armi	ligurian	85
1803	utf-8	en l’enfiern da la ‹commedia› preschenta el brunetto latini sco ina sort magister quai ch’ha manà en la perscrutaziun a numerusas speculaziuns	romansh	142
5377	utf-8	на саму же певицу имело влияние творчество групп radiohead queen deep purple «аквариум» и «кино»	erzya	96
5324	utf-8	އެއީ ބަލި ޖެހިފައި ހުރިމީހަކު ފަތާ ފެންގަނޑު ބޭނުންކުރުމުން ފެނުގެ ތެރެއަށް ޖަރާސީމް ވާޞިލްވެ އެގޮތުގެ މަތިން އެފެންގަނޑުގައި ފަތާ އެހެން މީހުންގެ ހަށިގަނޑަށް ޖަރާސީމް ވާޞިލްވުމުގެ ފުރުޞަތު އިތުރުވާތީ އެވެ	dhivehi	205
2512	utf-8	ꭴꮕꮜ ꭰꮫꮝꭼ   m   ꮷꮎꮃꮟꮥꮎ ꭽꮻꮎꮧꮲ ꮒꭶꮕꭿꮢ ꭰꮄ ꭶꮩꮧ  kg   ꭲꮷꮣꭸꮣ	cherokee	52
5547	utf-8	ls églyises du vouêt et les cheinnes dlêst caltchulent les leunes slon un difféthent almonnas et dé couôteunme pâques arrive un difféthent dînmanche pouor les catholiques et les protestants dun bord et pouor ls orthodoxes daut bord	narom	231
3198	utf-8	imithi ehlala iluhlaza yimithi egcina amagqabi ayo ebusika	xhosa	58
3279	utf-8	പുഷ്പിക്കുന്ന സസ്യങ്ങളിൽ റുബിയേസീ കുടുംബത്തിലെ ഒരു ജനുസ്സാണ് കീറ്റിയ  keetia	malayalam	76
1290	utf-8	akkuma mioo dhiiraa malee dubartiin hinulfoofne waaqayyo bokkaa bishaan akka dacheen magarsitu godhu roobsee obaasa lamaanuu barbaachisaadha	oromo	140
6620	utf-8	mikolo mitano sima ya kosala bolingo okoki kosenga emergency contraception kasi malamu oluka misalisi mbangu toloba mikolo misatu sima ya kosala bolingo	lingala	152
6554	utf-8	лавуазье опубликует работу в которой описаны аналогичные опыты позднее им был сформулирован и опубликован закон сохранения вещества — результаты опытов м	russian	153
1797	utf-8	ilklabb ħa sehem għalewwel darba filkompetizzjoni tattazza ewropea flistaġun –	maltese	78
3781	utf-8	эдэй засаг ᠡᠳ᠋ ᠦᠨ ᠵᠠᠰᠠᠭ гү али эдэй засаг хобор хизгаарлагдмал нөөсэ баялигые ниигэм ба ниигэмэй бүлэг нэгэжүүдэй одоогой ба ерээдүйн хэрэгсээ шаардалгые хангаха зорилгоор хэрхэн яажа үрэ дүнтэй ашаглаxа зарсуулха талаар һунгалта хэхэ шиидэлые һудалдаг ниигэмэй шэнжэлхэ ухаан юм	buryat	279
2601	utf-8	рабий iулаууал мазэм муслъымхэм ягъафiэр мухьэмэд бехъымбар сау къыщалъхуа махуэр	kabardian	81
2883	utf-8	ꭽꮻꮎꮧꮲ  ꭰᏸꮅ ꭴꮼꮺꮃꮕꭹ ꮶꭲꮑ ꮣꮣꮑꮴꮈ ꭼꮩꮧ ꮎꮵ ꭰꮒꮫꮵ ꭰꮄ fascist ᏺꮆ ꭴꮩꮲꮢ ꭿꭰ ꭸꮫꮝꮫꭲ ꮔꮎꮃꮒꭼꭼ	cherokee	74
2759	utf-8	главне реформе везане за римокатоличку цркву су биле спроведене за вриеме владавине марије терезије док су реформе за вриеме владавине њеног сина јозефа биле у вези с њиховим некатоличким поданицима	serbian	198
2184	utf-8	ông hết sức ủng hộ việc xây dựng nhà bảo tàng cuộc nổi dậy warszawa và năm  ông bổ nhiệm một nhóm người nghiên cứu lịch sử để ước tính các thiệt hại vật chất do người đức gây ra cho thành phố trong thời kỳ thế chiến thứ hai một ước tính % thành phố bị hủy hoại trong cuộc nổi dậy warszawa như một sự trả lời trực tiếp cho các đòi hỏi tăng cao từ những người đức bị trục xuất khỏi ba lan sau thế chiến thứ hai	vietnamese	408
2935	utf-8	lėgė  m	samogitian	7
1865	utf-8	la revenuo per capita por la urbo esis	ido	38
85	utf-8	ගොර්යෝ රාජවංශ සමය – පුළුල් පරාසයක පැතිරිවිශේෂයෙන්ම කුඹල් කර්මාන්තයෙහිශිල්පීන්ගේ දක්ෂතාවන්ගෙන් හැඩවූ කලාවේ විශිෂ්ට අවධියක් ලෙස සැලකිය හැක	sinhala	136
2697	utf-8	نظم و نثر فارسی و تاجیکی در طول چندین عصرها ترقی می‌کرد	persian	55
1298	utf-8	di jiyana xwe ya kurt de antoine de saintexupéry di nav herdu şerên cîhanî de derbas dibe	kurdish	89
3180	utf-8	quando pertual detenie un basto ampério colonial la zeignaçon mais quemun para chamar la parte de l território nacional na península eibérica era metrópole	mirandese	155
5106	utf-8	nasser ei lõhkunud islami nõutud poliitika ja religiooni ühtsust	estonian	64
4317	utf-8	osm mm kanónů bylo umístěno na hlavní palubě zbylá dvě byla za pancéřovými štíty na přídi a na zádi plavidla	czech	108
4143	utf-8	the  proprietors and associates of the school met on august  of that year and resolved to erect a new school building near the site of the old one naming seven trustees to thereafter oversee the education of local children	english	222
3126	utf-8	la su capital es tallín	extremaduran	23
4593	utf-8	umzekelo yicarbon dioxide okanye ioxygen emanzini	xhosa	49
186	utf-8	씨족 사회와 그 집단을 통치하는 지배자 계급이 발생함으로써 성씨는 다른 씨족이나 피지배 계급과 구별하기 위한 목적 즉 정치적 신분을 나타내는 표지로 쓰이게 되었다	korean	90
2792	utf-8	de bevolkiengsdichteid bedroe  minsn per km²	zeeuws	44
5533	utf-8	ny insee dia mampiasa ny kaodimpaositra	malagasy	39
635	utf-8	kūmet prezėdentėnis liektovs nokrėta šalėp smuolenska rosėjuo	samogitian	61
4719	utf-8	гэхдээ энэ нь  байж болно	mongolian	25
5186	utf-8	argentum ly	lojban	11
1286	utf-8	mans älaboms lemesedi patedik mö us  leigodü us  vomas	volapük	54
