doc_id	encoding	sentence	label	sentence_length
5510	utf-8	科索沃嘅主權地位向來都係一個好受國際社會所關注嘅問題，其中當地大部分嘅阿族人一直爭取同要求科索沃獨立，好多時重用好激進同暴力嘅方法爭取，但塞族人則視科索沃為塞爾維亞自古以嚟嘅固有領土，唔能夠就咁畀阿族搞獨立運動。終於喺年月號，時任科索沃總理哈辛·塔奇起科索沃首都普里什蒂納國會單方面宣佈脫離塞爾維亞共和國獨立，但唔係個個國家都承認，大多數承認科索沃主權的國家係歐盟成員國。	cantonese	186
3554	utf-8	지옥과 아귀는 비록 사람과 비슷하다 하더라도 큰 고통을 받기 때문에 사람의 세계人道에는 들지 못하며 아수라는 힘도 세고 형상이 사람과 하늘들과 비슷하기 때문에 따로 여섯째의 세계六道로 세우는 것이다	korean	110
359	utf-8	merilai a mariakristiina lotman toim	estonian	36
1000	utf-8	nama alternatif adalah jugum berasal dari bahasa latin iugum berarti penyeimbang	indonesian	80
5785	utf-8	saint placide  croé  ed  mètes éd hauteur et pi éd  tonnes d béton édseur ch terril in rapinsemint des mineurs morts au turbin	picard	126
2965	utf-8	el monumento fue desinyado kon el buto de azer de sembol de la resistansia de los djudios en eretz akodesh en kontro de akeyos ke tentan kitar la su egzistensya	ladino	160
5046	utf-8	‏שאול‎‏‎‎ тарсынхи саул савл тарсянин ивр	buryat	41
3800	utf-8	sağlık ocağı ve sağlık evi yoktur	turkish	33
6623	utf-8	айыы диэн тылбыт сатаан саҥарбаттан буолбакка киһи оҥорор быһыыларыттан тутулуктанан икки аҥы арахсан утарыта өйдөбүллээҕин билбэт араас тыл үөрэхтээхтэрэ учуонайдар сымыйа экстрасенстар ойууннар билигин элбэхтэр	yakut	212
4594	utf-8	iiliquids zinganyibilika kwezinye iiliquids kwaye neegases zinganyibilika kwezinye iigases	xhosa	90
6428	utf-8	nna knowles bu onye african american na mma ya bu onye ndi louisiana creole african american diạlạ amerika na french ébé ndi creole shi nọr na obodo louisiana ime amerika	igbo	170
3558	utf-8	პორტუგალიის სამეფო — შუა საუკუნეების მონარქია დასავლეთ ევროპაში პორტუგალიას თანამედროვე რესპუბლიკის წინამორბედი	georgian	111
5793	utf-8	യുവക്രിക്കറ്റ് കളിക്കാരെ മുംബൈയിലെ ശിവാജി പാർക്കിൽ കളി പരിശീലിപ്പിച്ചതിന്റെ പേരിൽ പ്രശസ്തനാണ്	malayalam	93
3272	utf-8	ju moanskelhaid humor un optimismus fon do ljuude wiese dät jan steen do goud koande un positiv deerstaale wüül	saterfriesisch	111
5989	utf-8	او پدې لار کې په نه ستړې کېدونکي تلاښ لاس پورې کړ، او له هېڅ ډول کوښښ او سعي يې سرفه ونکړه	pushto	90
4094	utf-8	кърымым йокіри  гъэм алий и хэкум къигъэзэжын къемыхъуліэу тыркум макіуэ	kabardian	72
358	utf-8	sovet dil siyasəti standartlarından avropa standartlarına doğru azərbaycan nümunəsi azerbaijan focus jurnalı – no  yanvarmart  azərbaycan dilində ingilis dilində	azerbaijani	161
5907	utf-8	ونه مردمون ویشته سُنّی ِعرب هستنه	mazanderani	33
4771	utf-8	„í mínum huga er lára hanna fyrst og fermst kraftmikill samfélagsrýnir og fjölmiðlamaður	icelandic	88
3688	utf-8	en los cuatro relatos el bautismo de jesús coincide con una teofanía que en marcos la versión más antigua posiblemente es descrita así	chavacano	134
1532	utf-8	небоскребу тутуу сыаната  млрд дуоллар	yakut	38
5311	utf-8	biyyonni odola ta’an kan garba kana keessatti argaman madagaaskaar kan durri rippabiliikii madagaaskaar jedhamu kan addunyaa keessaa odola guddinaan afraffaa ta’e komoroos siishelsi maaldiivis mooriishes fi sirilaankaa dha	oromo	222
6600	utf-8	елдан бернадот карл юхан ил белән идарә итә башлый	tatar	50
6360	utf-8	say zip code to et	pangasinan	18
1837	utf-8	ireo fajiry ireo dia manana voany vita vy sady/na nikela ho anny ankamaroanizy ireo	malagasy	83
1593	utf-8	en  la ville dévînt la ville auve la pus grande populâtion du monde en pâssant londres	narom	86
1377	utf-8	wara żewġ promozzjonijiet flistaġuni – u – kv mechelen waslu lura għallewwel diviżjoni	maltese	86
878	utf-8	ಕಿಬುಟ್ಜ್ಂದು ಬುಕ್ಕೊಂಜಿ ಬಗೆತ ಹಿಡುವಳಿ ವ್ಯವಸ್ಥೆ	tulu	43
4423	utf-8	ಕರ್ನಾಟಕರಾಜ್ಯೊದ ದಕ್ಷಿಣ ಕನ್ನಡ ಜಿಲ್ಲೆದ ಆದಿವಾಸಿ ಜನಾಂಗಡು ಕೊರಗ ಒಂಜಿ ಜಾತಿದ ಪುದರ್	tulu	73
3574	utf-8	per al tânti frâni dimòndi cà uriginêli în stêdi arfâti e despès àn mantgnû j artéstich purtêl durègin dal sêsetsèint	emilian	117
3387	utf-8	dieser versuch auch nach dietrich einen fürstenberger auf den bischofssessel in paderborn zu bringen scheiterte am zunehmenden einfluss der wittelsbacher im nordwesten des heiligen römischen reiches	german	198
2999	utf-8	niʼiijíhí łání éí beehai bikéyah bikáaʼdi áhootʼéego bił hazʼą́ áádóó éí bílaʼashdlaʼii náóltahígíí biniiyé náhásdzo	navajo	116
4183	utf-8	язык и литература комипермяков в социокультурном пространстве пермского края // материалы региональной конференции	komi-permyak	114
5457	utf-8	ಈ ಬ್ಯಾಂಡ್ ಸಾಂದರ್ಭಿಕವಾಗಿ ಹೆಚ್ಚು ಕಾರ್ಯಕ್ರಮಗಳನ್ನು ನಡೆಸಲು ಮತ್ತು ಇನ್ನುಳಿದವರ ಪೈಪೋಟಿಗಾಗಿ ತನ್ನ ಕಾರ್ಯ ಆರಂಭಿಸಿತು	kannada	102
2794	utf-8	яр педучилищеез  но удмурт университетэз  быдтӥз	udmurt	48
3344	utf-8	sääl ommaq ilmunuq kangro bernardi näütemäng susi võro kiilde pandnuq kauksi ülle bulgakovi mihhaili jutt saadanajant võro kiilde pandnuq jüvä sullõv ja häniläse luulõkogo ma pühäpääväpõllõ mõsi	võro	194
5770	utf-8	ny fisiana aradaharampehintany ary aradaharanjarahasinilay kaominina dia ° ary ° aminny soratra desimaly	malagasy	104
6057	utf-8	kudi ne wadan darajar su danganta ne da darajar kudaden turai na euro	hausa	69
1052	utf-8	христосын шашин исламын шашин ч гэсэн дэлгэрч эхэлжээ	buryat	53
3443	utf-8	víóla og fiðla eru mjög skyld hljóðfæri og fyrir þá sem ekki þekkja þau vel getur verið mjög erfitt að þekkja þau í sundur í sjón	icelandic	129
4270	utf-8	dovudo a ła continua rivada de sedimenti al lago durante el secoło xix el łago sevitava a inpenirse cussida che łe forse cołoniałi fransexi łe ga scavà un canal łongo  km łargo  m e profondo  m	venetian	193
877	utf-8	ಅವು ಅಯೆಗ್ ಹಣನ್ ಉತ್ಪನ್ನಕ್ಕ್ ಮಾರುಕಟ್ಟೆಯನ್ನ್ ಕೊರ್ಪೆರ್	tulu	50
4508	utf-8	king ko bb	hausa	10
6378	utf-8	taktiež existujú viditeľné vstupy do potrubnej pošty a údajne zdvojené stropy umožňujúce práce na inštaláciách bez veľkého búrania muriva	slovak	137
4541	utf-8	terradessus anophthalmus adolah kumbang dari famili dytiscidae	minangkabau	62
2079	utf-8	камсыздандыруу камсыздоосу – айрым объекттер же камсыздандыруучунун баардык мүлкү камсыздандырылган мүлктү камсыздандыруудагы абсолюттук нарктык кошунду	kirghiz	152
3235	utf-8	муниципалитеттің басшысы — биргит эрб	kazakh	37
6491	utf-8	millum mest nýttu metallini kunnu nevnast jarn kopar sink aluminium tin og blýggj	faroese	81
250	utf-8	वेद ग्रंथांपासून पुराणकथांपर्यंत व बडबड गीतांपासून ते तत्वज्ञानापर्यंत कासवाचा संचार आहेभारतात मंदिरामध्ये देवतेपुढे असलेले कासव हेही असेच महतत्वाचे मानले जाते	marathi	159
5809	utf-8	исрафилов художникпостановщик т	russian	31
162	utf-8	gie jinminra je rijblabi xabjinme fio simsa le tinci le xumfrakai	lojban	65
2126	utf-8	iti napno a panaglayus ti amasona laeng ti dakdakkel	iloko	52
3930	utf-8	catni selbangu la fasyban	lojban	25
5239	utf-8	تر دې وروسته يوچيان او تخاريان سره گډ شول او يو غښتلی او بېل ټبر ځنې جوړ شوی چې د کوشي، کوي کوشانگکوشان مشهوره قبيله د همدې خلکو له پنځگونو قبيلو څخه وه	pushto	152
4651	utf-8	sa bhliain  measadh go raibh  duine ina gcónaí i mbaile an chollaigh	irish	68
4917	utf-8	walay kabaleg tan sukat to ya  sq	pangasinan	33
4864	utf-8	latvėjuo gīven  mėlėjuonā gīventuoju	samogitian	36
1316	utf-8	stoljeću	serbo-croatian	8
3938	utf-8	sare lokal desberdinentzako azpibatzorde batzuk antolatu ziren ondorengo moduan	basque	79
2574	utf-8	ব্রাজিলর  মারির মানুলেহা লোক গননা অনুসারে লৌরো ডে ফ্রেইটাস পৌরসভাহানর জনসংখ্যা ইলাতাই  গ। অতার মা মুনি % গ বারো জেলা/বেয়াপা %গ। এরে পৌরসভার মানু গ শহরেদে বারো গ গাঙেদে থাইতারা। হারি বর্গ কিলোমিটারে গ মানু পরিসি।	bishnupriya	212
5750	utf-8	перем ладорсис кытшыс босьтӧ ойрытвыв тор	komi-permyak	41
1912	utf-8	همدرانگه د شتمنو هيوادونو په منځ کې په نړيوالو سياسي او پوځي سازمانو ملگري ملتونه ، د امنيت شورا، ناټو او نړيوالو اقتصادي جوړښتونو نړيوال بانک، د پيسو نړيوال صندوق، د سوداگرۍ نړيوال سازمان، پورته ذکر شوې کميټې کې د امريکا متحده ايالاتو رول او ونډې، همدارنگه د نړۍ په هیوادونو د نوو ليبرالانو د امپراطورۍ او اصولو منل او د امريکايی لوړپوړو چارواکو له خوا په ښکاره او ډاگه د نړۍ د مشرتوب او لارښوونې ادعا ته په کتو سره زما په فکر د نړيوال کولو د اصطلاح په ځای به د نړې امريکايی کولو اصطلاح کارول د اوسنيو واقعيتونو سره سمون ولري	pushto	526
4727	utf-8	клімат мустангу порівняно сухий оскільки дощові хмари обмежуються навколишніми високими горами	ukrainian	94
4893	utf-8	wataqa griguryanu kalindaryukama killachawwan qallarisqa chhasku watam karqan hulyanu kalindaryukamataq illapachawwan qallarisqa chhasku watam	quechua	142
5196	utf-8	‘massen’ yw furv kernewek an hanow yn bywnans meryasek	cornish	54
4785	utf-8	з цягам часу дзяржава паслабела ў выніку збяднення і закабалення свабоднага сялянства частых войнаў і пад	belarusian	105
164	utf-8	तरी लेगीत भारतीय रेल्वेपरिवहानांत रेल्वे परिवहन ही एक भौशिक सेवा ह्या तत्वाचेर जनतेंत आनी राजकीय पांवड्यार लक्ष केंद्रीत केल्ल्यान आनी रेल्वे परिवहन हो एक उद्देगय आसा	konkani	166
2374	utf-8	duranti a staghjoni secca da ghjinnaghju à ghjugnu u nilu biancu cuntribuisci trà u % è u % di a purtata dacqua tutali di u nilu	corsican	128
109	utf-8	unong ed  census say papulasyon to et  totoo	pangasinan	44
3104	utf-8	धावत जाऊन त्यांनी लोकमान्यांना आपण विष्णुबुवांकडून आलो आहोत असे सांगितले	marathi	72
4522	utf-8	mar sin is leacht é a reonn ina oighear ag o °c agus a fhiuchann chuig gás/galuisce ag  °c	irish	90
5557	utf-8	desne pritoke su grajanski gologorički i švički potoci koji zajedno daju južni krbunski potok	croatian	93
5303	utf-8	pòwszechny w dzysdniowim swiece gregòriańsczi kalãdôrz zaczął bëc ùżiwóny dopiérze w  na zôczątkù leno w niechtërnëch katolëcczich krajach	kashubian	138
4440	utf-8	и бжыгъэмкӏэ кӏуэдынхэм нэса къуалъэбзу лӏэужьыгъуэхэм ящыщщ	kabardian	60
1508	utf-8	гарын үсэг зурах ёслолд ануын ерөнхийлөгч жимми картер оролцсон байна	mongolian	69
4612	utf-8	ха́нтт руз	erzya	10
5441	utf-8	verê coy manê na qısey/qesey disporti keyfkerdış wext raviyarnayış u kaykerdış biyo < fransızkiyo kıhan desport latinki desportare xo xecelnayışo	dimli	145
2379	utf-8	incolae adtilianenses appellantur	latin	33
1677	utf-8	a cuntat cun laria el vapur de laqua al vegn püssee fregg el se cundensa in dun areosol furmaa de gut piscininn che rifrang la lüs del suu e la fan vegnì dun culur panaa bianch	lombard	176
1549	utf-8	mokgatlho wa kankere mo botswanacab o rotloetsa thibelo ya kankere dithuto tsa botsogo ka methale e tshwana le dithuto seka dipuisano ipapatso le go aba dipampitshana tsa kitsiso mo lefatsheng ka kakaretso	tswana	205
3508	utf-8	l’égllése ortodoxe des tèrres tch·èques et de slovaquie ou égllése orthodoxe tch·èca et slovaca est una égllése ortodoxe ôtocèfala	arpitan	130
3267	utf-8	dät rakt two soarten fon belääse foar disse ferbiendenge	saterfriesisch	56
52	utf-8	pape de glesie catoliche dal  di otubar  fint a la sô muart	friulian	59
870	utf-8	ಇಸ್ರೇಲಿನ ಕೃಷಿ ವಿಭಾಒಟ್ ಗಣನೀಯವಾಯಿನ ಬದಲಾವಣೆನ್	tulu	42
6161	utf-8	osvaldo ardiles	quechua	15
6070	utf-8	ka tī punkteni ir tiuli kluot vīnai taisnei tod sadalejums atbiļst zipfa lykumam	latgalian	80
5616	utf-8	журналист писал что под влиянием продюсера леонида бурлакова певица радикально сменила имидж «немытую челку и дутый жилетик сменили модный кожаный плащ — кажется от „гуччи“ — и стильные очки»	erzya	191
4318	utf-8	loď nesla  nábojů pro každý mm kanón a  nábojů pro každý mm kanón	czech	65
5392	utf-8	كۇچادىكى تەڭرىتاغ سىرلىق جىلغىسى يىلى بايقالغاندىن بۇيان، بىر تەرەپتىن ئېچىش ۋە بىر تەرەپتىن ساياھەتچىلەرنى كۈتۈۋېلىش خىزمىتى قانات يايدۇرۇلۇپ، ساياھەتچىلەر كۈندىن كۈنگە كۆپەيدى	uighur	177
4480	utf-8	އެއީ އެމީހުން ބުނާގޮތުގައި އިބްލީސް، މާތް ﷲ ފިޔަވައި އެހެންއެއްވެސް ފަރާތަކަށް ސަޖިދެއެއް ނުކުރިއެވެ	dhivehi	100
1800	utf-8	מענטשן מיט אלע מיני חולאים און פונעם גאנצן ארום זענען געקומען צו פארן קיין טשענגער געהאלפן צו ווערן מיט א רפואה אפילו די גויים זענען פיל געקומען צו אים	yiddish	151
494	utf-8	монгол орон ба тангудуудын нутаг газар хэмээх энэхүү ном нь монсудар хэвлэлийн газараас эрхлэн гаргаж буй монголоор бэдэрсэн гадныхан цувралын нэгэн боть юм	mongolian	156
1323	utf-8	हिमालयाचे दक्षिणेक रावपी कांय आदिवासी सिनोतिबेटन भाशावर्गांतली भास उलयतात	konkani	73
1815	utf-8	buuru bàmbara yi fama ak seeni jàmbaar tondion amoon nanu doole lii moo tax ahmadu bari tabax imbraatoor gu pël ca massina kese	wolof	127
1016	utf-8	джульетта — тайӧ уранлӧн спутник	komi	32
2842	utf-8	ang dapit palibot sa malicky oil field kay hapit walay nagpuyo uban sa ubos sa  molupyo kada kilometro kwadrado	cebuano	111
4952	utf-8	રણછોડગઢ તા	gujarati	10
3560	utf-8	dzeļžalaiki irā pyrmaviesturis pūsms kod reikus suoca gotovūt nu dzeļzs	latgalian	71
4992	utf-8	кожнае такое рашэнне яўляецца канчатковым і асоба яка звярнулася з заявай не можа патрабаваць яе перагляду	belarusian	106
3356	utf-8	ny faritrora dia gmt+	malagasy	21
2208	utf-8	upitnici terensko i laboratorijsko prikupljanje podataka su ostali tipovi tehnika korištenih u kvantitativnim istraživanjima	serbo-croatian	124
5923	utf-8	inlandsklimat råder i trakten	swedish	29
677	utf-8	estes pallabres dicen muncho del so mou de trabayar que busca siempre averase al mundu real y cotidianu que vive la xente mozo anguaño	asturian	134
977	utf-8	эфир арыыларын өлүүтэ диплоид үүнээйилэргэ ортотунан  % триплоид —  % тетраплоид —  % буолар	yakut	92
3885	utf-8	c est l etrernete k a permetou l atôtchance pa emile u pa messaedjreye sol moumint	walloon	82
5699	utf-8	ඇතැන්ස් නගර රාජ්‍ය විසින් පොදු අනන්‍යතාවක් වර්ධනය කර ගැනීමේ අරමුණින් එහි මිත්‍රශීලී පාර්ශව ගණනකටම මෙම උත්සවය අපනයනය කරන ලදී	sinhala	123
1158	utf-8	viralline kieli on arabien kieli	livvi-karelian	32
2692	utf-8	ny laharampokontaniny dia	malagasy	25
6083	utf-8	bộ phim này cũng giúp cô được đề cử giải nữ nhân vật được yêu thích và nữ diễn viên tiến bộ nhất	vietnamese	96
439	utf-8	under zeune jan ii van avesnes volgde jan i van holland ip de zeune van floris v	vlaams	80
1977	utf-8	dabei pendelt ein triebwagen im zweistundentakt zwischen eyach und hechingen landesbahn kursbuchstrecke	german	103
2261	utf-8	александр криницкий  август  сентябрь  тверь тверь губернасы рәсәй империясе— октябрь  мәскәү ссрб — инкыйлабчы совет дәүләт эшлеклесе	tatar	134
3850	utf-8	में बिहार के तत्कालीन मुख्यमंत्री लालू प्रसाद यादव और अन्य नेताओं ने राज्य के पशु पालन विभाग को लेकर धोखाबाजी से लिए गए  करोड़ रुपये कथित रूप से निगल लिए।	hindi	154
5025	utf-8	nasi ambeng adalah hidangan yang disajikan dalam selamatan sebagai sebagai lambang keberuntungan	indonesian	96
1990	utf-8	boken beskriver også møter med frege wittgenstein whitehead og kurt gödel	bokmål	73
4043	utf-8	enillodd plaid cymru  sedd yn yr etholiad a wedir buddogoliaethau ffurfiodd clymblaid gydar blaid lafur  y tro cyntaf ir blaid lywodraethu cymru yn ei hanes	welsh	156
1676	utf-8	la scighera ciamada anca gheba nebia o burda a lè un fenomen meteurulogich che lè pruvucaa de levapuraziun de laqua che la ghè in del sör o in duna distesa de aqua in süperfiss	lombard	176
6029	utf-8	자신의 이야기를 ucc로 만들려고 한 그는 자신의 엄마가 자신을 자유롭게 해 주었다고 회상한다	korean	52
2251	utf-8	li ronde take rissatchîye deus bokèts d griyâdje èt lès pèxhons s ritrovîne rostis l pia tote crèvaudêye mmmm avou dès canadas à l pèlake èt ène nokète di bûre do nwâr martchi	walloon	175
2543	utf-8	сары гүлдері себет гүлшоғырына топталған	kazakh	40
5152	utf-8	gonempeda flava adolah lalek dari famili limoniidae	minangkabau	51
4388	utf-8	чи пехота бригаданы бирбир бёлеклери десант кемеледен портстенлини къатында тюшедиле	karachay-balkar	84
2151	utf-8	ju kontinentoaldrift is uk ju uurseeke foar äidbieuwjen uumdät sik uk däälich noch do waarelddeele ferskuuwe	saterfriesisch	108
3313	utf-8	ಟೆಸ್ಟ್ ಕ್ರಿಕೆಟ್ ನಲ್ಲಿ ಅತ್ಯದಿಕ  ಶತಕದ ಜೊತೆಯಾಟ ನೀಡಿದಾತ	kannada	51
1138	utf-8	regularitas jarak antara jalur pumusingan orbitorbit naini kamungkinan merupakan efek resonansi sisa tumatan tatambayan tabantuknya tata surya	banjar	142
6062	utf-8	en  eune louai griyit un conmité métropolitain dtravaux metropolitan board of works et organnîsit les vestiaithes des pâraisses à seule fîn dgouvèrner londres	narom	158
570	utf-8	chinmetière  édseur ch meunumint funéraire à pascal françois il y o ène viérche à linfant in « bos d fer » foaite pèr léstchulpteu daniel patin	picard	143
3095	utf-8	çĕрпӳ районĕ — административной таркань буе чувашонь республикасо россиясо	erzya	74
6534	utf-8	ఇలా చేస్తూ సాధించే సాంకేతిక ప్రక్రియే స్టాప్ మోడన్ యానిమేషన్	telugu	60
185	utf-8	한국에서 성씨가 사용되기 시작한 정확한 시기는 알 수 없으나 한자漢字 등 중국 문물이 수입되었던 시기에 그와 함께 도입되었을 것으로 추정된다	korean	78
3653	utf-8	el rehormismu borbónicu hizu angunus cámbeus ena olganiçación políticuterritorial despaña cumu el criaeru e las audéncias i entendéncias	extremaduran	136
1755	utf-8	ଜୁନରେ ନିଜ କର୍ମକ୍ଷେତ୍ରକୁ ଫେରିବା ପରେ ଏହା ପ୍ଲାୟମୌଥରେ ନିଯୁକ୍ତ ପାଇଥିଲା ।  ଜୁନରେ ଏହା ସାଣ୍ଟାନାଜାଏରରୁ ସାଧାରଣ ଲୋକ ଓ ବନ୍ଧୁ ସେନାଙ୍କୁ ମୁକୁଳେଇବା କାର୍ଯ୍ୟ କରିଥିଲା । ଏହା ପୁଣିଥରେ  ଜୁନରେ ପୋଲିସ ବାହିନୀକୁ ମୁକୁଳେଇବା ପାଇଁ ଆସିଥିଲା ।  ଅଗଷ୍ଟରେ ଜିବ୍ରାଲଟରରୁ ଆସିବାରେ ଫୋର୍ସ ଏଚ ଜାହାଜକୁ ଅନ୍ୟ ହୋମ ଫ୍ଲିଟ ବିଧ୍ୱଂସକାରୀଙ୍କ ସହ ମିଶି ସୁରକ୍ଷା ଦେଇଥିଲା । ସେପ୍ଟେମ୍ବରରେ ଉତ୍ତର ପଶ୍ଚିମକୁ ଯିବାବେଳେ ଡ଼ାକାର ଆକ୍ରମଣରେ ଅପରେସନ୍ ମେନାସରେ ପଞ୍ଜାବୀ ରକ୍ଷୀ ଜାହାଜ ଭାବେ କାମ କରିଥିଲା । ଏହା ମଧ୍ୟ କ୍ଷତିଗ୍ରସ୍ତ ଯୁଦ୍ଧ ଜାହାଜ ଫିଜିକୁ ବ୍ରିଟେନ ଫେରିବା ସମୟରେ ସୁରକ୍ଷା ଦେଇଥିଲା । ବର୍ଷର ବାକି ସବୁ ସମୟରେ ତାକୁ ଫ୍ଲୋଟିଲା ସହ ମୁତୟନ କରାଯାଇଥିଲା ।  ଅକ୍ଟୋବରରେ ମାଟାବେଲ ପଞ୍ଜାବୀ ଓ ସୋମାଲି ମିଶି ନରୱେ ସାଗରରେ ଜଳବାୟୁ ଜାହାଜ ଜର୍ମାନ ପାଣିପାଗ ଜାହାଜ ଡବ୍‌ଲ୍ୟୁ ବି ଏସ  ଆଡ଼ଲ୍ଫ ଭିନରକୁ ବୁଡ଼ାଇ ଦେଇଥିଲେ ।	oriya	688
3765	utf-8	ஸ்ரீநிவாசா சினிடோன் நிறுவனத்தினரால் வெளியிடப்பெற்ற இத்திரைப்படத்தில் பி	tamil	71
6104	utf-8	èdè tí a fi kọ kọ̀ráànù sílẹ̀ ni a ń pè ní ‘classical’ tàbí ‘literary arabic’	yoruba	77
2813	utf-8	aynı zamanda  yılından bu yana ilk defa birinciyi tele oylama değil jüri oyları belirlemiştir	turkish	93
4990	utf-8	c obutagunjula baana nga bato kufuga mbeerza zaabwe ez’obuntu	luganda	61
3611	utf-8	i françois bosment no benny tanàna mandritry ny taona –	malagasy	55
405	utf-8	wurde das erste virus constructor kit für makroviren geschrieben das es auch personen ohne programmierkenntnissen ermöglichte viren zu erstellen	pampanga	144
5093	utf-8	pa	bokmål	2
2825	utf-8	neile on omistatud vanakreeka laadide nimetused joonia dooria früügia lüüdia miksolüüdia eoolia ja lokria	estonian	105
3006	utf-8	max von sydow დ	georgian	15
1577	utf-8	èlèvo a l’institucion rèyâla dus jouènos avôgllos il modifie et amèlyore lo code barbier	arpitan	88
4761	utf-8	bordessoules   paches  isbn	picard	27
